,title,where,other,chanquan,price,price-pre,square
13,天鹅湖套二精装地铁房，中间楼层，投资，刚需型自住,天鹅湖北苑??2室2厅??79平米??西北,新会展二手房/中楼层(共31层)/2007年建板塔结合,距离1号线世纪城站318米独家随时看房,85万,10760 元/m2,108人看过此房
14,精品学区房 龙湖经典大套三 赠送可抵公摊 真正拎包入,龙湖三千里B区二期??3室2厅??134平米??东北,SM广场二手房/高楼层(共33层)/2009年建塔楼,建设路小学本部独家随时看房,160万,11941 元/m2,53人看过此房
15,清水房  视野好 川师旁边 7号线 川师站出口 ,德馨苑??4室2厅??152.22平米??东南,川师二手房/中楼层(共32层)/2011年建塔楼,菱S路小学随时看房,198万,13008 元/m2,27人看过此房
16,交大沃尔玛+地铁7号线+精装三房+业主自住装修保养好,锦城名都??3室2厅??111.98平米??东南,营门口二手房/中楼层(共32层)/2009年建板塔结合,独家随时看房,132万,11788 元/m2,81人看过此房
17,体院对面 中庭两居 全新装修 拎包入住 可直接落户 ,香月楠岸??2室2厅??91.63平米??南,双楠二手房/高楼层(共21层)/2009年建板塔结合,武侯实验小学距离3号线高升桥站678米独家随时看房,96万,10477 元/m2,58人看过此房
18,装修花费40W　保养好　诚心出售　直接入住,阳光春天??3室2厅??137平米??南,火车南站二手房/中楼层(共18层)/2008年建塔楼,科华中路小学独家随时看房,146万,10657 元/m2,36人看过此房
19,地铁4号线旁 精装2房 从未入住 ,保利香槟光华??2室1厅??59.03平米??西,万家湾二手房/高楼层(共18层)/2000年建板楼,实小西区距离4号线中坝站911米独家随时看房,72万,12198 元/m2,32人看过此房
20,新上73平经典户型、不临街。直接入住！,锦城名都??2室1厅??73.66平米??西南,营门口二手房/低楼层(共33层)/2008年建板塔结合,独家随时看房,80万,10861 元/m2,90人看过此房
21,泊景湾 高层精装朝南套二 端头位置 采光好,泊景湾??2室2厅??86.68平米??南,龙湾二手房/高楼层(共18层)/2008年建板塔结合,川大附小清水河校区独家随时看房,115万,13268 元/m2,62人看过此房
22,标准套二顶楼带房子，买一层送一层，投资居家都是好选择,星辉中路14号??2室1厅??68平米??南 北,马鞍路二手房/高楼层(共7层)/2000年建板楼,距离4号线太升南路站1156米满五年唯一,65万,9559 元/m2,4人看过此房
23,红牌楼丽都世家精装全配套二，客厅带大阳台，拎包入住,丽都世家B区??2室1厅??75平米??南,丽都二手房/中楼层(共17层)/2014年建板楼,距离3号线太平园站410米独家随时看房,99万,13200 元/m2,44人看过此房
24,西城天下125平米，东南朝向，精装修套三，主卧带阳台,西城天下??3室2厅??125平米??东南,茶店子二手房/低楼层(共31层)/2009年建板塔结合,茶店子小学南区距离2号线羊犀立交站350米独家随时看房,135万,10800 元/m2,35人看过此房
25,华润六期 套三双卫 黄金楼层 精装空房 从未住过人,华润二十四城六期??3室1厅??96平米??东北,万象城二手房/中楼层(共27层)/2016年建板塔结合,距离4号线万年场站站73米独家随时看房,148万,15417 元/m2,94人看过此房
26,石油苑单位房200平米平台花园精装修 可拎包入住,石油苑??2室2厅??97.24平米??西北,猛追湾二手房/低楼层(共18层)/2009年建板塔结合,距离3号线前锋路站452米独家随时看房,138万,14192 元/m2,32人看过此房
27,红牌楼楠丽湾70年产权精装标间 地铁三号线附近,楠丽湾??2室1厅??30.35平米??南,红牌楼二手房/中楼层(共13层)/2005年建板楼,距离3号线红牌楼站139米独家随时看房,39万,12851 元/m2,38人看过此房
28,送楼超大楼顶花园，标准套三，地铁房,锦翠北苑??3室2厅??101平米??南,武侯立交二手房/高楼层(共6层)/板楼,满五年唯一,75万,7426 元/m2,2人看过此房
29,柳城阳光精装套二 跃层 诚意出售,柳城阳光??2室2厅??73.28平米??南,温江大学城二手房/高楼层(共11层)/2007年建板楼,满五年唯一,42万,5732 元/m2,9人看过此房
,title,where,other,chanquan,price,price-pre,square
0,地铁口 万达旁 稀缺标准套三 楼王位置 朝南对中庭,光华逸家??3室2厅??93平米??南,外光华二手房/高楼层(共22层)/2012年建板楼,同辉小学距离4号线中坝站370米独家随时看房,123万,13226 元/m2,78人看过此房
1,南三环，开发商统一港式精装大套一，可投资可自住,叠翠峰??1室1厅??82.5平米??北,城南宜家二手房/低楼层(共25层)/2010年建板塔结合,距离1号线火车南站站659米房本满两年随时看房,100万,12122 元/m2,43人看过此房
2,光华大道地铁口，刚需小套三，中庭楼王位置,公园大道??3室2厅??89.16平米??南,光华大道沿线二手房/中楼层(共29层)/2012年建板塔结合,房本满两年随时看房,56万,6281 元/m2,25人看过此房
3,电梯学区房 稀缺大套一  全中庭采光视野极佳,汇景樱桃季??1室1厅??57.69平米??南,外双楠二手房/高楼层(共9层)/2005年建板楼,棕北西区房本满两年随时看房,49万,8494 元/m2,37人看过此房
4,错层套二双卫 对中庭花园安静,蜀都花园??2室2厅??100.38平米??南,水碾河二手房/低楼层(共22层)/2003年建板楼,教师进修校附小距离4号线玉双路站849米房本满两年随时看房,98万,9763 元/m2,38人看过此房
5,五大花园 跃层套二 采光好 通透明朗 低总价 急售,会所花园??2室2厅??96平米??南,五大花园二手房/高楼层(共16层)/2002年建板楼,晋阳小学房本满两年随时看房,68万,7084 元/m2,32人看过此房
6,精装房 自住装修 楼王位置 对中庭 储物空间特别多,天悦府??3室2厅??131平米??南 北,大源二手房/中楼层(共31层)/2014年建板塔结合,蒙小随时看房,258万,19695 元/m2,39人看过此房
7,绝版户型，明厨明卫，正对中庭，标准两室，客厅带小阳台,锦江城市花园二期??2室1厅??50.21平米??东南,三圣乡二手房/高楼层(共34层)/2010年建塔楼,锦江外国语小学房本满两年随时看房,42万,8365 元/m2,50人看过此房
8,锦江印象专盘维护人为您推荐,锦江印象??3室2厅??102.3平米??南,合江亭二手房/中楼层(共31层)/2008年建板塔结合,龙王庙小学距离2号线东门大桥站820米随时看房,130万,12708 元/m2,66人看过此房
9,檀香山  开发商全新精装房 未入住 对公园  套四,檀香山??4室2厅??137平米??南,丽都二手房/低楼层(共18层)/2009年建板楼,玉林附小距离3号线红牌楼站1023米随时看房,187万,13650 元/m2,31人看过此房
10,阳光新业，稀缺户型，投资住家首选。,阳光新业??3室2厅??128平米??南,合江亭二手房/中楼层(共44层)/2014年建板塔结合,距离2号线牛王庙站272米房本满两年随时看房,200万,15625 元/m2,22人看过此房
11,茶店子地铁口恒大西锦城3梯5户精装自住房无税急售,恒大西锦城??2室2厅??89.52平米??南,国宾二手房/中楼层(共29层)/2012年建塔楼,距离2号线茶店子客运站站293米房本满两年随时看房,93万,10389 元/m2,42人看过此房
12,3.7.10号线地铁口稀缺套三，中层对中庭，户型通透,下一站都市??3室2厅??114.5平米??西南,丽都二手房/中楼层(共17层)/2014年建板楼,距离3号线太平园站254米随时看房,120万,10481 元/m2,66人看过此房
13,九里堤学区房 标准套二清水房 首付2.5成 采光好,兴元绿洲一期??2室1厅??83平米??东南 西南,金府二手房/低楼层(共22层)/2009年建塔楼,房本满两年随时看房,62万,7470 元/m2,33人看过此房
14,地铁口恒大套三中间楼层，采光好，交通便利，随时看房,恒大西锦城??3室2厅??124平米??西北,国宾二手房/低楼层(共29层)/2012年建塔楼,距离2号线迎宾大道站304米房本满两年随时看房,116万,9355 元/m2,37人看过此房
15,买一层送一层、稀缺跃层、春熙观景房、地铁3、4号相伴,正成财富ID??2室2厅??67.93平米??西北,盐市口二手房/中楼层(共31层)/2005年建板楼,距离1号线天府广场站136米房本满两年随时看房,75万,11041 元/m2,33人看过此房
16,芳草东街一号院，一楼套二，不临街，正读芳草小学,芳草东街一号院??2室1厅??63.89平米??东,芳草二手房/低楼层(共7层)/2000年建板楼,芳草小学距离1号线倪家桥站970米房本满两年随时看房,56万,8766 元/m2,40人看过此房
17,16平米大阳台  4.5米开间  送负一楼产权车位,百仁安盛??3室2厅??186平米??南,高家庄二手房/低楼层(共18层)/2008年建板楼,迎宾路小学房本满两年随时看房,155万,8334 元/m2,34人看过此房
18,地铁旁居家经典跃层套一,新巢小区二期??1室1厅??62平米??南,广福桥二手房/中楼层(共7层)/2005年建板楼,石室双楠实验学校距离3号线高升桥站406米房本满两年随时看房,51万,8226 元/m2,48人看过此房
19,3号地铁房，黄金楼层，全面对中庭，南北通透,撷英卉苑??3室2厅??113平米??南,李家沱二手房/中楼层(共7层)/2001年建板楼,李家沱实验小学房本满两年随时看房,95万,8408 元/m2,101人看过此房
20,君临天下★彰显您的身份★双拼紧凑别墅★无浪费面积,君临天下??4室2厅??197平米??南,成外二手房/低楼层(共1层)/2004年建,犀浦实验小学房本满两年随时看房,245万,12437 元/m2,42人看过此房
21,四海逸家 稀缺双卫 带车位 免税急售,四海逸家一期??4室2厅??88平米??南,卓锦城二手房/高楼层(共34层)/2010年建板塔结合,锦江外国语小学房本满两年随时看房,197万,22387 元/m2,26人看过此房
22,稀缺电梯小高层洋房   简单装修,西区花园水云阁??3室2厅??118平米??西南,犀浦二手房/中楼层(共11层)/2007年建板楼,犀浦实验小学距离2号线天河路站658米房本满两年随时看房,68万,5763 元/m2,63人看过此房
23,经典楼王  超大赠送  户型巴适,空港十六区??4室2厅??155平米??西南,航空港二手房/低楼层(共18层)/2009年建板楼,川大西航港实小房本满两年随时看房,102万,6581 元/m2,30人看过此房
24,肿瘤医院宿舍 两房两厅 南北对流 稀缺小户型,肿瘤医院研究所宿舍??2室1厅??58平米??南 北,火车南站二手房/低楼层(共7层)/2000年建板楼,距离1号线火车南站站379米房本满两年随时看房,52万,8966 元/m2,53人看过此房
25,金牛公园旁 黄金10楼 价格实惠 简单装修,嘉宇天琢城??2室2厅??86.55平米??东北,花照壁二手房/低楼层(共32层)/2008年建板楼,行知小学距离2号线茶店子客运站站1177米房本满两年随时看房,67万,7742 元/m2,66人看过此房
26,客厅正出阳台 视野开阔 全中庭 可看到双流,彩叠园1A期??2室1厅??87平米??南,光华大道沿线二手房/中楼层(共18层)/2013年建板塔结合,房本满两年随时看房,55万,6322 元/m2,60人看过此房
27,航空港 居家套二 90平上户神器 随时看房,和贵久居福??2室1厅??90平米??南,航空港二手房/中楼层(共18层)/2008年建板塔结合,川大西航港实小房本满两年随时看房,58万,6445 元/m2,48人看过此房
28,鑫苑名家稀缺套二对中庭，采光好,鑫苑名家二期??2室1厅??64.51平米??东,卓锦城二手房/高楼层(共34层)/2012年建塔楼,锦江外国语小学房本满两年随时看房,60万,9301 元/m2,74人看过此房
29,地铁口森林主题稀缺洋房一楼 送30平米亲地花园带车位,锦绣森邻??3室2厅??187平米??东南,光华大道沿线二手房/低楼层(共5层)/2008年建板塔结合,房本满两年随时看房,116万,6204 元/m2,33人看过此房
,title,where,other,chanquan,price,price-pre,square
0,带车位出售 标准套三 对中庭 房东诚心出售,置信丽都花园城C区??3室2厅??139平米??南,新双楠二手房/中楼层(共13层)/2006年建板楼,百草园小学房本满两年随时看房,142万,10216 元/m2,57人看过此房
1,一环路边，简装大套二双卫，公园学区房,新华园??2室2厅??95.55平米??东,新华公园二手房/中楼层(共7层)/2000年建板楼,成华小学距离4号线双桥路站1005米房本满两年随时看房,85万,8896 元/m2,74人看过此房
2,地铁口 海科名城 清水套二 大阳台,海科名城??2室2厅??88平米??南 北,温江大学城二手房/中楼层(共18层)/2011年建板楼,房本满两年随时看房,43万,4887 元/m2,21人看过此房
3,一环边前锋小区，简装套二，黄金四楼，卧室带阳台,前锋小区??2室1厅??58平米??南,李家沱二手房/中楼层(共6层)/1995年建板楼,李家沱实验小学房本满两年随时看房,50万,8621 元/m2,34人看过此房
4,橡树林清水套一赠送超大可改套二,望江橡树林一期??1室1厅??56.21平米??东,三官堂二手房/高楼层(共34层)/2009年建板塔结合,盐道街小学东区房本满两年随时看房,76万,13521 元/m2,35人看过此房
5,西花汀难得小户型套三双卫，户型巴适方正通透，实惠方便,西花汀??3室2厅??118平米??西南,珠江新城二手房/低楼层(共11层)/2008年建板楼,房本满两年随时看房,73万,6187 元/m2,55人看过此房
6,精装套三 可改套四哦  诚心出售 随时看房！！！！,晶宝盛世桃源??3室2厅??97平米??东南,犀浦二手房/低楼层(共18层)/2012年建板塔结合,犀浦外国语学校房本满两年随时看房,65万,6702 元/m2,41人看过此房
7,简装稀缺小套二  黄金楼层  随时看房 欢迎来电,兴元华盛1期??2室1厅??61平米??东北,驷马桥二手房/中楼层(共18层)/2008年建板塔结合,双水碾小学房本满两年随时看房,50万,8197 元/m2,36人看过此房
8,新上可看中庭楼王 四期稀缺内跃带花园 房屋利用率高 ,二十一世纪花园四期??3室2厅??147平米??东 南,贝森二手房/高楼层(共6层)/2003年建板楼,青羊实验附小距离4号线清江西路站952米房本满两年随时看房,128万,8708 元/m2,38人看过此房
9,一环内+电梯房+河景房+单价低,顺通河滨公寓??3室2厅??193.63平米??西,猛追湾二手房/高楼层(共9层)/2002年建板楼,距离4号线市二医院站559米房本满两年随时看房,140万,7231 元/m2,79人看过此房
10,地铁房 永辉就在家门口 亏本惜售三房 实得约110平,果壳里的城??3室2厅??88.8平米??东,龙泉驿城区二手房/高楼层(共34层)/2012年建塔楼,距离2号线书房站741米房本满两年随时看房,53万,5969 元/m2,88人看过此房
11,内双楠品质大盘，名都苑多层套三，单价优质，采光好,名都苑??3室2厅??122.07平米??东南,双楠二手房/中楼层(共6层)/2002年建板楼,石室双楠实验学校距离3号线高升桥站944米房本满两年随时看房,110万,9012 元/m2,107人看过此房
12,天鹅湖花园  空中豪宅 超大花园,天鹅湖花园??7室2厅??548平米??南,新会展二手房/低楼层(共30层)/2008年建板楼,世纪城南路学校距离1号线世纪城站261米房本满两年随时看房,500万,9125 元/m2,27人看过此房
13,园林式小区，中庭朝南，中等装修可拎包入住。可直接上户,龙城国际??3室2厅??106平米??南,橡树湾二手房/中楼层(共33层)/2013年建板塔结合,思源小学房本满两年随时看房,70万,6604 元/m2,81人看过此房
14,体育学院对面 中庭套二 地铁口 带车位出售 随时可看,香月楠岸??2室1厅??88平米??南,双楠二手房/高楼层(共21层)/2009年建板塔结合,武侯实验小学距离3号线高升桥站678米房本满两年随时看房,100万,11364 元/m2,63人看过此房
15,地铁学区双优+南北通透,融城理想??3室1厅??132平米??西,市一医院二手房/中楼层(共16层)/2005年建板塔结合,距离1号线高新站227米房本满两年随时看房,145万,10985 元/m2,84人看过此房
16,公园大道6米挑高跃层 户型好,公园大道??3室2厅??123平米??南,光华大道沿线二手房/中楼层(共13层)/2012年建板塔结合,房本满两年随时看房,64万,5204 元/m2,91人看过此房
17,中间楼层前新装修套二打家具家电出售,劲力蓝色理想??2室2厅??78平米??西南,航天二手房/中楼层(共26层)/2006年建板塔结合,龙泉四小房本满两年随时看房,46万,5898 元/m2,62人看过此房
18,朝阳时代西锦，学区房。清水套2,朝阳时代西锦??2室2厅??89平米??南,花都大道二手房/低楼层(共33层)/2014年建板楼,温江光华实验小学房本满两年随时看房,44万,4944 元/m2,64人看过此房
19,紫竹苑 70产权住宅 高新实小学区 临近地铁 大套二,紫竹苑??2室2厅??98平米??南,紫荆二手房/中楼层(共8层)/2001年建板塔结合,高新实小旧校区房本满两年随时看房,95万,9694 元/m2,115人看过此房
20,建设路 精装套二 户型方正保养好 正读建设路小学,首创爱这城??2室1厅??93.78平米??南,建设路二手房/中楼层(共29层)/2009年建板塔结合,建设路小学本部房本满两年随时看房,94万,10024 元/m2,42人看过此房
21,标准套三双卫 单价便宜 可根据喜爱改造客厅和卧室,万科魅力之城二期??3室2厅??149平米??南 北,成渝立交二手房/中楼层(共11层)/2008年建板楼,树德小学距离2号线成渝立交站179米房本满两年随时看房,130万,8725 元/m2,66人看过此房
22,豪华装修大户型套三,四季豪廷??3室2厅??123平米??东南,郫县城区二手房/高楼层(共30层)/2010年建板塔结合,房本满两年随时看房,80万,6505 元/m2,57人看过此房
23,南门省人大小区 稀缺中庭 超大赠送 学区房 无营业税,神仙树馨苑??2室2厅??78.71平米??南,新北二手房/高楼层(共23层)/2011年建板塔结合,房本满两年随时看房,73万,9275 元/m2,84人看过此房
24,套二   精装   全新家具家电  ,香水城??2室2厅??74.96平米??南,龙泉驿城区二手房/高楼层(共28层)/2012年建板塔结合,房本满两年随时看房,54万,7204 元/m2,77人看过此房
25,清水大气套三   一眼就会爱上的户型,橙郡一期??3室2厅??128.85平米??南 北,中海国际二手房/高楼层(共17层)/2007年建板塔结合,西芯小学房本满两年随时看房,115万,8926 元/m2,46人看过此房
26,艺锦湾带大平台 套三双卫 户型方正 正常首付 有钥匙,艺锦湾三期??3室2厅??111平米??北,龙泉驿城区二手房/中楼层(共6层)/2013年建板塔结合,距离2号线书房站300米房本满两年随时看房,125万,11262 元/m2,23人看过此房
27,央企华侨城，经典户型，机不可失失不再来,华侨城纯水岸三期??2室1厅??72.99平米??西南,华侨城二手房/高楼层(共33层)/2013年建塔楼,人北小学华侨城房本满两年随时看房,88万,12057 元/m2,39人看过此房
28,二环内少陵路套三 南北通透  63万入住内双楠,菊园??3室2厅??89.75平米??南,双楠二手房/高楼层(共7层)/2002年建板塔结合,房本满两年随时看房,63万,7020 元/m2,58人看过此房
29,蜀馨苑A区 稀缺大套三 对中庭 学区房,蜀馨苑A区??3室1厅??97.8平米??南,双楠二手房/高楼层(共7层)/2000年建板塔结合,房本满两年随时看房,72万,7362 元/m2,37人看过此房
,title,where,other,chanquan,price,price-pre,square
0,顶跃套五户型好保养好拎包入住,丽景华庭二期??3室2厅??168平米??西北,外双楠二手房/中楼层(共12层)/2006年建板楼,川大附小清水河校区房本满两年,185万,11012 元/m2,29人看过此房
1,新上房源，中粮祥云大平层，南北通透户型，电梯入户,中粮祥云一期??5室2厅??213平米??东南,武侯立交二手房/中楼层(共18层)/2000年建板楼,龙江路小学祥云分校房本满两年,288万,13522 元/m2,24人看过此房
2,精装套二楼顶带花园,菊园??2室1厅??57.46平米??南,双楠二手房/高楼层(共7层)/2002年建板塔结合,满五年唯一独家,47万,8180 元/m2,11人看过此房
3,东南采光套二温馨之家，学区房正读娇子小学，铂金楼层,天紫界??2室2厅??68.56平米??南,九眼桥二手房/高楼层(共55层)/2011年建板楼,距离2号线牛王庙站231米房本满两年,100万,14586 元/m2,43人看过此房
4,羊犀立交地铁口    精装套三 一楼带花园 正读茶小,金域港湾??3室2厅??115平米??东南,茶店子二手房/低楼层(共11层)/2006年建板塔结合,茶店子小学南区距离2号线羊犀立交站82米房本满两年,125万,10870 元/m2,67人看过此房
5,黄金2楼 正对中庭不临街 套三带书房 高端小区,香榭名苑??4室2厅??158.06平米??西南,府南新区二手房/低楼层(共7层)/2001年建板楼,实小战旗分校距离2号线蜀汉路东站561米房本满两年,165万,10440 元/m2,44人看过此房
6,稀缺顶跃 双层花园  视野开阔 几年难遇,大华情融苑??5室3厅??244平米??北,外双楠二手房/高楼层(共11层)/2002年建板楼,川大附小西区房本满两年,230万,9427 元/m2,35人看过此房
7,新都区，保利公园198蝴蝶谷100+平米花园别墅,保利公园198蝴蝶谷西区??4室2厅??348.16平米??西北,保利公园二手房/低楼层(共3层)/2000年建板楼,房本满两年,266万,7641 元/m2,36人看过此房
8,多一个站 房价少一半 畅销户型！,珠江御景湾??4室2厅??142平米??西南,珠江新城二手房/高楼层(共18层)/2015年建板楼,房本满两年,108万,7606 元/m2,40人看过此房
9,伊藤盘 双地铁口中间 依云镇清水一跃2 带车位,依云??4室2厅??166平米??南 北,温江新城二手房/低楼层(共4层)/2007年建板楼,房本满两年,130万,7832 元/m2,43人看过此房
10,青羊实验附小学区房 买一层送一层 带屋顶超大花园,二十一世纪花园四期??4室2厅??127平米??南,贝森二手房/高楼层(共7层)/2003年建板楼,青羊实验附小距离4号线清江西路站952米房本满两年,115万,9056 元/m2,37人看过此房
11,简装套三单卫，户型方正，满两年无营业税,龙湖北城天街二期??3室2厅??105平米??南 北,五块石二手房/低楼层(共23层)/2013年建塔楼,五块石小学房本满两年独家随时看房,116万,11048 元/m2,36人看过此房
12,17万装修没有住过人，中庭位置装修全部赠送超级棒的房,凯德风尚??2室2厅??93平米??东,外光华二手房/高楼层(共19层)/2012年建板楼,草堂子美校区房本满两年独家随时看房,109万,11721 元/m2,9人看过此房
13,只此一套 购房首选 自住投资拆迁全能选手,海椒市街13号??2室1厅??58.47平米??东北,九眼桥二手房/中楼层(共7层)/1998年建板楼,距离2号线牛市口站498米房本满两年独家随时看房,49万,8381 元/m2,19人看过此房
14,小户型套二，清水，刚需型用户首选,上东阳光美悦林??2室2厅??70.25平米??东北,洪河二手房/低楼层(共33层)/2012年建塔楼,房本满两年独家随时看房,53万,7545 元/m2,20人看过此房
15,房东急售，大户型套三，单价才4700,东方华美苑??3室2厅??137平米??西南,龙泉驿城区二手房/低楼层(共30层)/2007年建板塔结合,满五年唯一随时看房,65万,4745 元/m2,5人看过此房
16,小区中庭 采光好 一梯两户 学区房 ,亲水美居??3室2厅??113.53平米??南,九里堤二手房/高楼层(共6层)/2001年建板楼,九里堤小学房本满两年独家随时看房,88万,7752 元/m2,37人看过此房
17,高品质小区 客厅卧室都朝南 看清水河 精装修带家具家,天合凯旋天际湾??2室1厅??86平米??南,光华泡小二手房/高楼层(共21层)/2011年建板塔结合,泡小西区房本满两年独家随时看房,110万,12791 元/m2,36人看过此房
18,超大阳台自住房子。拎包入住，品质住宅,武侯国际花园??1室2厅??66.61平米??东北,红牌楼二手房/高楼层(共13层)/2009年建板楼,房本满两年独家随时看房,72万,10810 元/m2,21人看过此房
19,上东锦城精装套二,上东锦城A区??2室2厅??88平米??西南,琉璃场二手房/高楼层(共33层)/2008年建板楼,房本满两年独家随时看房,62万,7046 元/m2,37人看过此房
20,双楠花园稀缺顶层带花园精装套二 三面采光  拎包入住,双楠花园??2室1厅??87平米??南,双楠二手房/高楼层(共6层)/2002年建板楼,石室双楠实验学校距离3号线红牌楼站662米房本满两年独家随时看房,84万,9656 元/m2,50人看过此房
21,西南设计院单位房+标准套二+总价低+投资,星辉西路8号??2室1厅??63平米??北,马鞍路二手房/高楼层(共6层)/2000年建板楼,人民北路小学西区距离1号线人民北路站839米房本满两年独家随时看房,58万,9207 元/m2,57人看过此房
22,钢管厂五区，顶楼带花园的套二,钢管厂五区??2室2厅??70.42平米??东南,莲花二手房/高楼层(共7层)/2001年建板楼,教师进修校附小距离2号线牛市口站564米房本满两年独家随时看房,56万,7953 元/m2,38人看过此房
23,三圣乡 免税 买精装修拎包入住优质套二变套三,锦江城市花园三期??2室2厅??74.12平米??西南,三圣乡二手房/低楼层(共34层)/2011年建板塔结合,锦江外国语小学房本满两年独家随时看房,60万,8095 元/m2,38人看过此房
24,清水河边稀缺别墅  带大花园  满两年  诚心售哦 ,置信丽都玉园领邸??4室2厅??242平米??南,万家湾二手房/低楼层(共5层)/2000年建板楼,房本满两年独家随时看房,330万,13637 元/m2,14人看过此房
