,title,where,other,chanquan,price,price-pre,square
0,地铁口 会展旁 紧挨龙湖 看江景房 超大阳台视野超好,成达佳园??3室2厅??161平米??南 北,新会展二手房/高楼层(共32层)/2009年建板楼,世纪城南路学校距离1号线世纪城站749米房本满两年,128万,7951 元/m2,17人看过此房
1,超大两局  采光好 简单装修 即可拎包入住,武侯国际花园??2室2厅??86.29平米??东北,红牌楼二手房/高楼层(共13层)/2009年建板楼,房本满两年,78万,9040 元/m2,51人看过此房
2,度假村+精装修居家小套二+独家代卖,白鸽岛尚??2室2厅??77.27平米??东 北,高家庄二手房/中楼层(共19层)/2008年建塔楼,迎宾路小学房本满两年,64万,8283 元/m2,43人看过此房
3,四季家园，稀缺一楼套三，中等装修，可直接拎包入住,四季家园??3室2厅??113平米??南,紫荆二手房/低楼层(共7层)/2000年建板楼,高新实小旧校区房本满两年,100万,8850 元/m2,34人看过此房
4,100多平私家花园 种花养鱼聚友喝茶 带车位安静洋房,翡翠城一期??4室2厅??142平米??东南,东湖二手房/低楼层(共11层)/2005年建塔楼,成师附小华润分校房本满两年,355万,25000 元/m2,20人看过此房
5,多层洋房 2楼带大平台 居家首选 有钥匙随时看房,艺锦湾一期??3室2厅??135平米??东 西,龙泉驿城区二手房/中楼层(共5层)/2013年建板塔结合,距离2号线书房站500米房本满两年随时看房,120万,8889 元/m2,8人看过此房
6,地铁口，活出人生精彩！大公园，成就现代休闲生活！,果壳里的城??3室2厅??88平米??北,龙泉驿城区二手房/高楼层(共34层)/2012年建塔楼,距离2号线书房站993米房本满两年随时看房,74万,8410 元/m2,13人看过此房
7,{大花园}{西南朝向}{地铁房}{随时看房},中粮香颂丽都??3室1厅??83.83平米??西南,丽都二手房/低楼层(共19层)/2015年建板楼,红牌楼小学距离3号线太平园站1059米随时看房,140万,16701 元/m2,18人看过此房
8,川大河畔，经典套四户型，清水房0首付0首付0首付,川大河畔??4室2厅??131.78平米??南,航空港二手房/高楼层(共6层)/2005年建板楼,西航港小学房本满两年随时看房,66万,5009 元/m2,7人看过此房
9,塞尔稀缺顶跃，南北通透户型！,麓山国际塞尔维蒙??4室2厅??205.09平米??南,麓山二手房/高楼层(共4层)/2008年建,房本满两年随时看房,210万,10240 元/m2,26人看过此房
10,视野开阔+户型房子+居家装修+超高性价+省营业税,橙郡二期??2室2厅??85.83平米??南 北,中海国际二手房/高楼层(共17层)/2007年建板楼,西芯小学房本满两年独家随时看房,72万,8389 元/m2,42人看过此房
11,首付几万 买通透3房 免税费 双证在手 急售,格调城??3室2厅??86平米??西南,东山二手房/高楼层(共26层)/2012年建板塔结合,房本满两年随时看房,45万,5233 元/m2,25人看过此房
12,首付6万买三环内简装套一 对中庭 读磨子桥 刚需首选,兴元丽园A区??1室1厅??43.05平米??西南,武侯立交二手房/低楼层(共11层)/2005年建塔楼,磨小分校房本满两年独家随时看房,31万,7201 元/m2,10人看过此房
13,・,雅居乐花园??5室2厅??166平米??南,雅居乐二手房/低楼层(共32层)/2000年建板楼,房本满两年随时看房,90万,5422 元/m2,19人看过此房
14,对中庭，多层顶跃前后带花园，房东诚心，随时可看,金沙园三期??3室2厅??135.8平米??北,西单二手房/高楼层(共6层)/2004年建板楼,金沙小学距离4号线文化宫站541米,158万,11635 元/m2,81人看过此房
15,宽窄巷子近泡小 小高层电梯公寓 温馨通透套三,同仁居??3室2厅??125平米??南 北,宽窄巷子二手房/中楼层(共9层)/2000年建板楼,距离4号线宽窄巷子站448米,150万,12000 元/m2,43人看过此房
16,石室小学对面学区房 婚房装修 带大花园 中庭不临街,蜀馨苑B区??2室1厅??81平米??南,双楠二手房/高楼层(共7层)/1998年建板楼,石室双楠实验学校房本满两年独家,75万,9260 元/m2,3人看过此房
17,名都苑  钻石2楼  带40平花园  大气套三,名都苑??3室2厅??139.5平米??南,双楠二手房/低楼层(共6层)/2002年建板楼,石室双楠实验学校距离3号线高升桥站1014米,136万,9750 元/m2,75人看过此房
18,大平台 双主卧设计 南北通透 双进门 正对小区中庭 ,长城半岛1期??4室2厅??181平米??南,天府长城二手房/低楼层(共33层)/2010年建板塔结合,锦晖小学,238万,13150 元/m2,48人看过此房
19,四海逸家二期 稀缺跃层 朝南对中庭 免增值税哦,四海逸家二期??4室2厅??97平米??南,卓锦城二手房/低楼层(共34层)/2013年建板塔结合,锦江外国语小学,190万,19588 元/m2,82人看过此房
20,满两年省增值税 阔气D墅幻变29种户型 对中庭,四海逸家二期??4室2厅??124平米??东南,卓锦城二手房/高楼层(共34层)/2013年建板塔结合,锦江外国语小学,200万,16130 元/m2,99人看过此房
21,地铁稀缺多层，黄金三楼，带家具家电。,安居苑(温江区)??2室2厅??93平米??东南,温江老城二手房/中楼层(共7层)/2000年建板塔结合,满五年唯一,41万,4409 元/m2,2人看过此房
22,紧邻地铁站口 舒适居家套二 值得拥有,金都苑??2室2厅??78平米??南 北,五块石二手房/中楼层(共18层)/2009年建板楼,五块石小学随时看房,62万,7949 元/m2,27人看过此房
23,新绿季节 新上精装好房 还没住过 学区房！,新绿季节??3室1厅??122平米??南,紫荆二手房/高楼层(共14层)/2004年建板塔结合,高新实小旧校区距离1号线桐梓林站926米随时看房,135万,11066 元/m2,30人看过此房
24,欧城精装修，直接拎包入住，业主诚心！,桐梓林欧城??2室2厅??89平米??南,桐梓林二手房/低楼层(共22层)/2009年建塔楼,桐梓林小学距离1号线桐梓林站873米随时看房,125万,14045 元/m2,30人看过此房
25,交大八期 投资自住两不误 黄金楼层 低价急售,交大智能八期??1室1厅??44.14平米??东北,营门口二手房/低楼层(共6层)/2003年建板楼,行知小学随时看房,35万,7930 元/m2,37人看过此房
26,价格合理公道，紧邻沙河。,府青路二段4号新24号??2室2厅??74.83平米??东,李家沱二手房/高楼层(共6层)/2003年建板楼,李家沱实验小学满五年唯一,61万,8152 元/m2,4人看过此房
27,精装小套二  拎包入住 换房诚心出售！,鑫苑名家一期??2室2厅??60.88平米??南,卓锦城二手房/低楼层(共34层)/2011年建板塔结合,锦江外国语小学随时看房,51万,8378 元/m2,21人看过此房
28,锦江印象 朝南两居,锦江印象??2室1厅??74.66平米??东,合江亭二手房/中楼层(共31层)/2008年建板塔结合,龙王庙小学距离2号线东门大桥站820米随时看房,85万,11385 元/m2,26人看过此房
29,360的户型好房子安静居家视野好,朗御??1室1厅??89平米??南,合江亭二手房/低楼层(共50层)/2012年建板楼,锦官驿小学距离2号线东门大桥站543米随时看房,160万,17978 元/m2,31人看过此房
,title,where,other,chanquan,price,price-pre,square
0,双楠伊藤旁 中庭不临街  采光霸道,双楠美邻??2室1厅??92平米??南,外双楠二手房/高楼层(共12层)/2003年建板楼,棕北西区满五年唯一,85万,9240 元/m2,1人看过此房
1,华润凤凰城一期，朝南对中庭，客厅和卧室都带阳台，学区,华润凤凰城一期??3室2厅??145平米??南,大源二手房/低楼层(共27层)/2013年建板塔结合,益州小学随时看房,250万,17242 元/m2,22人看过此房
2,稀缺户型！精装修！！！交大万通格外！,交大万通格外??2室2厅??63平米??东南,丽都二手房/高楼层(共18层)/2011年建板楼,距离3号线太平园站594米随时看房,70万,11112 元/m2,23人看过此房
3,上东阳光三期 套三双卫 全面对中庭通透户型,上东阳光三期??3室2厅??118平米??南 北,洪河二手房/中楼层(共11层)/2009年建塔楼,随时看房,78万,6611 元/m2,23人看过此房
4,环境优美，配套齐全，学区房，,美茵河谷??3室2厅??128.68平米??南,花都大道二手房/中楼层(共11层)/2007年建塔楼,温江光华实验小学随时看房,83万,6451 元/m2,27人看过此房
5,【纯公园式小区 双铁房】【对双中庭+板式通透大套二】,派克公馆??2室1厅??90平米??南,成外二手房/高楼层(共12层)/2011年建板塔结合,犀浦实验小学距离2号线金周路站906米随时看房,63万,7000 元/m2,31人看过此房
6,红牌楼地铁3号线旁，交大格外小区，精装套二，小区安静,交大万通格外??2室2厅??72.15平米??西北,丽都二手房/低楼层(共18层)/2011年建板楼,距离3号线太平园站594米随时看房,80万,11089 元/m2,24人看过此房
7,上岛稀缺  客厅带阳台  低总价,翰林上岛??2室1厅??65平米??西,航空港二手房/中楼层(共16层)/2008年建板楼,西航港小学随时看房,53万,8154 元/m2,26人看过此房
8,对中庭两居室 经典户型 绝版清水房 明厨明卫,兴元绿洲一期??2室1厅??92.17平米??南,金府二手房/中楼层(共22层)/2009年建塔楼,随时看房,65万,7053 元/m2,23人看过此房
9,中间楼层+采光明亮，套三单卫，空房，随时看房,金牛万达D组团??3室2厅??81.08平米??东,金牛万达二手房/中楼层(共32层)/2013年建塔楼,人民北路小学东区距离1号线人民北路站758米随时看房,88万,10854 元/m2,27人看过此房
10,精装从未住人  南北通透视野巴适 拎包入住,天悦龙庭??3室2厅??117平米??南,琉璃场二手房/高楼层(共30层)/2014年建板楼,盐小锦馨分校随时看房,137万,11710 元/m2,29人看过此房
11,动物园金科  富丽花城精装套三随时看房,富丽花城??3室2厅??83平米??东,动物园二手房/中楼层(共18层)/2008年建板楼,北新实验小学满五年唯一,75万,9037 元/m2,2人看过此房
12,二环边+香木林+经典跃层+大赠送,香木林加州国际??2室1厅??44.33平米??西南,营门口二手房/高楼层(共18层)/2009年建塔楼,光荣小学随时看房,65万,14663 元/m2,24人看过此房
13,黄金三楼，学区套三，可上户保养好，拎包入住！,翠堤春晓??3室2厅??94.36平米??南,五大花园二手房/中楼层(共7层)/2002年建板楼,随时看房,81万,8585 元/m2,28人看过此房
14,万达旁一里阳光精装套三带家具家电诚心出售 紧邻二小,一里阳光??3室2厅??88平米??西 西北,郫县万达二手房/中楼层(共18层)/2013年建板塔结合,随时看房,52万,5910 元/m2,28人看过此房
15,交大路旁闹中取静+套三双卫+黄金四楼+单价低,锦西花园三期??3室2厅??114平米??西南,西南交大二手房/中楼层(共5层)/2003年建板楼,行知小学满五年唯一,90万,7895 元/m2,1人看过此房
16,红枫岭二期，精装套二，房东急售。,红枫岭二期??2室2厅??88平米??西北,东郊记忆二手房/低楼层(共33层)/2009年建塔楼,建设路小学本部满五年唯一,82万,9319 元/m2,2人看过此房
17,简装套一，可改套二，房东诚心出售。,王府锦苑??1室1厅??53.7平米??西,航空港二手房/低楼层(共6层)/2008年建板楼,川大西航港实小满五年唯一,37万,6891 元/m2,4人看过此房
18,蜀汉路泰逸阳光精装套一、投资过渡首选,泰逸阳光??1室1厅??62.06平米??南,一品天下二手房/中楼层(共5层)/2005年建板楼,石笋街小学新区距离2号线蜀汉路东站236米满五年唯一,50万,8057 元/m2,5人看过此房
19,二环旁，学区房，正读成华小学，底层适合老年人,锦绣东方一期??1室1厅??49.9平米??西,万象城二手房/低楼层(共33层)/2008年建塔楼,成华小学锦绣校区满五年唯一,50万,10021 元/m2,2人看过此房
20,玉林中学旁 精装套二，拎包入住，安静不临街，陪读首选,玉南苑??2室2厅??97.8平米??南,芳草二手房/高楼层(共7层)/2000年建板楼,芳草小学距离3号线衣冠庙站1027米满五年唯一,85万,8692 元/m2,1人看过此房
21,正对中庭，居家装修，业主诚心出售。,红枫岭三期??2室2厅??90平米??西南,东郊记忆二手房/中楼层(共28层)/2009年建板塔结合,建设路小学本部满五年唯一,75万,8334 元/m2,3人看过此房
22,精装  大户型  正读棠湖小学,宗申流溪别院??3室2厅??123平米??南,双流城区二手房/中楼层(共4层)/2005年建塔楼,棠湖小学满五年唯一,76万,6179 元/m2,1人看过此房
23,二环 清水套三 品质小区 学区房！沙河旁 居家选择,蓝光COCO时代??3室1厅??69.65平米??南,八里小区二手房/中楼层(共31层)/2014年建板塔结合,电子科大附小随时看房,89万,12779 元/m2,25人看过此房
24,户型方正，大户型，基本没有浪费空间，对中庭不临街,长虹和悦府??3室2厅??103平米??北,外光华二手房/中楼层(共20层)/板塔结合,距离4号线中坝站415米随时看房,150万,14564 元/m2,29人看过此房
25,金地纯中庭套一改套二，户型方正，重新装修，买房送全部,金地贝福里花园??2室1厅??79平米??东 西,桐梓林二手房/高楼层(共18层)/2007年建塔楼,桐梓林小学距离1号线桐梓林站819米独家随时看房,90万,11393 元/m2,26人看过此房
26,华润二期 开发商精装套二 朝南 光线好,华润二十四城二期??2室2厅??65平米??南,万象城二手房/高楼层(共32层)/2011年建塔楼,石室小学距离4号线万年场站站55米随时看房,95万,14616 元/m2,31人看过此房
27,3号线 标准全明套二  主卧超大转角飘窗,四季花城??2室1厅??84平米??南,广福桥二手房/低楼层(共21层)/2003年建塔楼,石室双楠实验学校距离3号线高升桥站593米随时看房,100万,11905 元/m2,23人看过此房
28,套三 对小区中庭 随时看房,彩叠园1B期??3室1厅??117平米??南,光华大道沿线二手房/中楼层(共18层)/2013年建板塔结合,随时看房,73万,6240 元/m2,12人看过此房
29,城南神仙树 兴元稀缺小套三双卫 带车位 拎包入住,兴元丽都??3室2厅??96平米??南,新北二手房/高楼层(共13层)/2006年建板楼,房本满两年,92万,9584 元/m2,23人看过此房
,title,where,other,chanquan,price,price-pre,square
0,西三环内 竹韵天府 多层套二 居家首选 小区环境好,竹韵天府??2室2厅??86平米??南,武侯立交二手房/低楼层(共6层)/2004年建板楼,满五年唯一,71万,8256 元/m2,3人看过此房
1,肖家河沿街 学区房（玉林附小） 单位房 套二带花园,肖家河沿街43号??2室2厅??99.3平米??西南,衣冠庙二手房/高楼层(共7层)/板楼,满五年唯一,83万,8359 元/m2,2人看过此房
2,龙湖三千城  学区房  朝南对中庭  有车位,龙湖三千城A区??3室2厅??139平米??南,SM广场二手房/高楼层(共34层)/2011年建板楼,建设路小学本部房本满两年独家,175万,12590 元/m2,15人看过此房
3,一楼简装套二，中庭不临街，客厅带阳台,丽景华庭一期??2室2厅??88.84平米??南,外双楠二手房/低楼层(共10层)/2003年建板楼,川大附小清水河校区满五年唯一,88万,9906 元/m2,3人看过此房
4,地铁口标准套三，黄金三楼，户型方正，龙江路分校学区房,武侯花园??3室2厅??107平米??南,华西二手房/中楼层(共5层)/1998年建板楼,龙江路小学分校距离3号线高升桥站56米满五年唯一,95万,8879 元/m2,2人看过此房
5,标准套一  小区环境优雅  配套完善  房东诚心出售,东林城市花园??1室1厅??62平米??东,动物园二手房/低楼层(共18层)/2008年建塔楼,北新实验小学房本满两年随时看房,46万,7420 元/m2,26人看过此房
6,地铁房 首付6万 产权已下免营业税中等装修买来就住,上锦颐园??2室1厅??89平米??东北,红光二手房/高楼层(共25层)/2008年建板塔结合,房本满两年随时看房,40万,4495 元/m2,12人看过此房
7,草市街文殊院 时代印象热卖户型 低总价 高回报,时代印象??1室0厅??41.87平米??东,草市街二手房/低楼层(共14层)/2005年建板塔结合,双眼井小学距离4号线太升南路站704米房本满两年独家,31万,7404 元/m2,30人看过此房
8,豪华装修，房东自住，对中庭，中高楼层,花样年花郡??1室1厅??44.22平米??南,万象城二手房/高楼层(共32层)/2008年建板塔结合,成华小学距离4号线双桥路站687米房本满两年独家,59万,13343 元/m2,17人看过此房
9,现代化欧式精装房  可拎包入住 赶快行动起来,御城??2室2厅??88.36平米??西北,新都城区二手房/中楼层(共26层)/2009年建塔楼,香城小学房本满两年,57万,6451 元/m2,15人看过此房
10,纯居家小区  电梯小高层  跃层套三带双卫,正成香域??3室1厅??47.5平米??东,草市街二手房/中楼层(共6层)/2005年建塔楼,双眼井小学距离4号线太升南路站603米随时看房,85万,17895 元/m2,26人看过此房
11,城南2.5环 免税学区房（高新实验小学） 标准套二,金竹苑A区??2室1厅??66.99平米??南,神仙树二手房/中楼层(共7层)/2001年建板楼,高新实小旧校区房本满两年独家随时看房,58万,8659 元/m2,12人看过此房
12,CBD别墅区清水大套四，赠送面积大，小区环境没法比,融创长滩壹号??4室2厅??226平米??东,文星镇二手房/中楼层(共4层)/板楼,房本满两年随时看房,350万,15487 元/m2,4人看过此房
13,公园房 读棠小 居家大套四 二胎首选,贵通御苑映月湾??4室2厅??129平米??南,东升镇二手房/高楼层(共16层)/板楼,房本满两年随时看房,87万,6745 元/m2,3人看过此房
14,泡小学区房,光华揽胜??2室1厅??50平米??南,光华泡小二手房/中楼层(共34层)/2010年建板楼,泡小西区随时看房,68万,13600 元/m2,26人看过此房
15,地铁口 中间楼层 纯河景房 视野超级巴适 带俩车位,佳兆业丽晶港??4室2厅??140.77平米??北,珠江新城二手房/中楼层(共33层)/2012年建板楼,房本满两年随时看房,120万,8525 元/m2,5人看过此房
16,简装经典顶跃   临街  带两个屋顶花园 ,南阳锦城??3室2厅??134.8平米??东,南湖二手房/高楼层(共6层)/2008年建板塔结合,西寺小学房本满两年随时看房,103万,7641 元/m2,3人看过此房
17,金河谷  七中旁跃层洋房 带多个平台,世豪金河谷??4室2厅??197平米??东南,光华大道沿线二手房/高楼层(共4层)/2016年建板塔结合,房本满两年随时看房,168万,8528 元/m2,1人看过此房
18,森桦苑 豪装顶跃两套打通 不临街 南北通透 随时看房,森桦苑??4室1厅??161.93平米??南,双楠二手房/高楼层(共17层)/2003年建板楼,武侯实验小学房本满两年随时看房,150万,9264 元/m2,5人看过此房
19,精装套二 送家具家电 拎包入住 满两年 没有增值税,中铁瑞景茗城??2室2厅??82.69平米??南,郫县城区二手房/低楼层(共18层)/2012年建板楼,房本满两年独家随时看房,46万,5563 元/m2,11人看过此房
20,华润橡树湾套二，低首付，满2年，免税！,华润橡树湾A区??2室1厅??49平米??西南,橡树湾二手房/高楼层(共32层)/2013年建板塔结合,思源小学房本满两年独家随时看房,31万,6327 元/m2,13人看过此房
21,盛世年华精装套三，明厨明卫，市中心，拎包入住,盛世年华??3室1厅??96平米??东,草市街二手房/中楼层(共17层)/2016年建塔楼,双眼井小学距离4号线太升南路站925米随时看房,130万,13542 元/m2,18人看过此房
22,中大五期，居家精装套二,中大君悦金沙五期??2室1厅??83平米??南,西单二手房/低楼层(共23层)/2012年建板楼,金沙小学距离4号线清江西路站127米随时看房,123万,14820 元/m2,15人看过此房
23,90平套二，精装修，上户条件简化,颐和京都??2室1厅??90.36平米??南,万家湾二手房/低楼层(共24层)/2012年建塔楼,实小西区房本满两年独家,86万,9518 元/m2,14人看过此房
24,一楼带花园 位置安静 交通方便 地铁7号线,城东雅郡??2室2厅??86.77平米??东南,东光小区二手房/低楼层(共6层)/2005年建板楼,菱S路小学房本满两年独家,115万,13254 元/m2,17人看过此房
25,浣花溪边电梯简装三居，全明户型送双阳台，采光视野无敌,金地花园??3室2厅??139平米??南,双楠二手房/高楼层(共18层)/2003年建塔楼,武侯实验小学随时看房,118万,8490 元/m2,15人看过此房
26,左拥伊藤 右抱名校  正对中庭 学区房,大华情融苑??3室2厅??170.5平米??南,外双楠二手房/中楼层(共11层)/2002年建板楼,川大附小西区房本满两年,195万,11437 元/m2,7人看过此房
27,地铁零距离，带120平平台花园，已搭建好，拎包入住,中大君悦金沙五期??3室2厅??84.17平米??西南,西单二手房/低楼层(共23层)/2012年建板楼,金沙小学距离4号线清江西路站127米房本满两年独家,205万,24356 元/m2,7人看过此房
28,世纪锦苑别墅 直降22万！22万！22万！房东急售！,世纪锦苑??4室2厅??321.9平米??南,桐梓林二手房/中楼层(共6层)/2004年建,桐梓林小学距离1号线桐梓林站915米房本满两年独家,688万,21374 元/m2,9人看过此房
29,标准套一、低价出售、五大花园唯一在售,交大广厦小区??1室1厅??45.53平米??南,五大花园二手房/中楼层(共7层)/2000年建板楼,磨小分校满五年唯一,31万,6809 元/m2,6人看过此房
,title,where,other,chanquan,price,price-pre,square
0,标准套一、低价出售、五大花园唯一在售,交大广厦小区??1室1厅??45.53平米??南,五大花园二手房/中楼层(共7层)/2000年建板楼,磨小分校满五年唯一,31万,6809 元/m2,6人看过此房
1,精装套二  户型方正大气,世纪光华??2室2厅??86平米??南,花都大道二手房/低楼层(共18层)/2007年建板塔结合,温江光华实验小学房本满两年随时看房,43万,5000 元/m2,20人看过此房
2,正读高新实验小学，精装修 拎包入住,彩世界??1室1厅??74平米??西南,紫荆二手房/高楼层(共9层)/2004年建板楼,高新实小旧校区距离1号线桐梓林站1149米独家随时看房,55万,7433 元/m2,31人看过此房
3,盛南领地 板式通透带拐角阳台 简装修满两年 看江景,盛南领地??3室2厅??168.27平米??东南,新会展二手房/高楼层(共26层)/2008年建板楼,世纪城南路学校距离1号线天府三街站394米独家随时看房,172万,10222 元/m2,6人看过此房
4,红牌楼 二环地铁口 精装套二 幻变套三 拎包入住,花样年华四期??2室1厅??77.86平米??南,红牌楼二手房/中楼层(共6层)/2005年建板楼,距离3号线红牌楼站421米独家随时看房,75万,9633 元/m2,50人看过此房
5,金林俊景08年后电梯房 纯清水 地铁就在家门口,金林俊景??3室2厅??89.19平米??南,五大花园二手房/低楼层(共17层)/2009年建板楼,龙祥路小学独家随时看房,80万,8970 元/m2,18人看过此房
6,霏红榭同户型最di价 中间楼层 超大赠送！,霏红榭??3室2厅??99.31平米??东南,航天二手房/中楼层(共25层)/2015年建板塔结合,龙泉三小房本满两年随时看房,56万,5639 元/m2,9人看过此房
7,户型方正 精装修 对中庭 东南朝向 中间楼层,锦江城市花园三期??2室1厅??56.59平米??东南,三圣乡二手房/中楼层(共34层)/2011年建塔楼,锦江外国语小学独家随时看房,53万,9366 元/m2,39人看过此房
8,新上正读天涯石太古里春熙路套三双卫电力局单位房,大慈寺路28号??3室2厅??136平米??南,红星路二手房/低楼层(共29层)/1999年建板楼,天涯石小学距离4号线市二医院站486米房本满两年随时看房,184万,13530 元/m2,9人看过此房
9,精装圣菲套二 送家具家电 直接拎包入住,蓝光圣菲town城??2室2厅??66.2平米??北,航空港二手房/高楼层(共23层)/2009年建塔楼,川大西航港实小房本满两年随时看房,49万,7402 元/m2,8人看过此房
10,主城区户口  稀缺1楼 可经商  实得100O  ,上锦颐园??2室1厅??89平米??西北,红光二手房/低楼层(共27层)/2008年建板塔结合,房本满两年随时看房,40万,4495 元/m2,8人看过此房
11,城投观城、东西通透、紧凑小户型、买到即赚,观城??2室2厅??75.88平米??南,万象城二手房/高楼层(共33层)/2013年建板塔结合,双庆小学距离4号线万年场站站435米独家随时看房,87万,11466 元/m2,53人看过此房
12,金沙国际花园，黄金楼层，拎包入住，临河临公园！,金沙国际花园??3室2厅??111.78平米??东,蜀汉路二手房/中楼层(共6层)/2005年建板楼,距离2号线羊犀立交站720米独家随时看房,119万,10646 元/m2,45人看过此房
13,户型方正，一环边，楼下就是地铁口,高升瑞景??2室1厅??55平米??南,高升桥二手房/高楼层(共20层)/2008年建板楼,红牌楼小学距离3号线高升桥站30米独家随时看房,65万,11819 元/m2,36人看过此房
14,东郊记忆旁红枫岭小高层楼王套二，简装朝南，低价出售,枫瑞苑??2室2厅??84平米??南,东郊记忆二手房/低楼层(共10层)/2009年建塔楼,建设路小学本部独家随时看房,72万,8572 元/m2,36人看过此房
15,精装套二 总价低 拎包入住 投资首选 房东可返祖,华润二十四城一期??2室2厅??90.17平米??东,万象城二手房/低楼层(共32层)/2007年建塔楼,石室小学距离4号线万年场站站601米独家随时看房,111万,12311 元/m2,46人看过此房
16,安顺苑 总楼层7楼的电梯房 精装拎包入住 ,安顺苑??3室2厅??118.5平米??南,川音二手房/中楼层(共7层)/1999年建板楼,距离2号线东门大桥站771米独家随时看房,120万,10127 元/m2,45人看过此房
