,title,where,other,chanquan,price,price-pre,square
12,中粮祥云三期 稀缺套三 户型方正 学区房,中粮祥云三期??3室2厅??136平米??南,武侯立交二手房/低楼层(共17层)/2014年建板楼,龙江路小学祥云分校随时看房,165万,12133 元/m2,130人看过此房
13,豪装套三，赠送超大L型景观入户花园，客厅带阳台，大气,金沙鹭岛一期??3室2厅??139平米??东南,金沙二手房/低楼层(共27层)/2010年建塔楼,金沙小学距离4号线清江西路站834米随时看房,200万,14389 元/m2,97人看过此房
14,三利云锦纯地铁房   江景房   客厅带阳台,三利云锦??3室2厅??131平米??南,华阳二手房/低楼层(共37层)/2013年建板塔结合,距离1号线华府大道站18米随时看房,140万,10688 元/m2,105人看过此房
15,三期稀缺138户型 带6米挑高入户 精装修 诚心出售,翡翠城三期??3室2厅??138平米??西南,东湖二手房/低楼层(共33层)/2008年建板楼,成师附小华润分校随时看房,230万,16667 元/m2,57人看过此房
16,晶蓝半岛大套三，绝佳通透户型，就读娇子小学,晶蓝半岛二期??3室2厅??124平米??西北,九眼桥二手房/高楼层(共27层)/2008年建板塔结合,娇子小学距离2号线牛王庙站363米随时看房,200万,16130 元/m2,167人看过此房
17,南北通透的中间楼层。观景大阳台,春天大道??3室2厅??130平米??南,光华大道沿线二手房/高楼层(共24层)/2009年建板塔结合,随时看房,89万,6847 元/m2,152人看过此房
18,买一层送一层 使用面积250平米 带60平花园 地铁,蜀郡又一城??6室2厅??110平米??东 西,华阳二手房/高楼层(共31层)/2014年建塔楼,距离1号线天府五街站935米随时看房,130万,11819 元/m2,56人看过此房
19,标准套四  客厅带阳台  客厅开间接近5米  学区房,金沙顺苑??4室2厅??146.38平米??南 北,西单二手房/低楼层(共11层)/2003年建塔楼,金沙小学距离4号线文化宫站501米房本满两年,145万,9906 元/m2,22人看过此房
20,市区东大路免税河景大平层 稀缺高层清水正看香格里拉,时代豪庭三期??3室2厅??172.53平米??东 南,合江亭二手房/高楼层(共34层)/2010年建板楼,锦官驿小学距离2号线东门大桥站391米随时看房,380万,22026 元/m2,270人看过此房
21,春熙路东门二号地铁时代豪庭正对中庭低楼层看小区绿化,时代豪庭四期??3室2厅??162.2平米??东南,合江亭二手房/低楼层(共40层)/2011年建板塔结合,锦官驿小学距离2号线东门大桥站391米随时看房,380万,23428 元/m2,100人看过此房
22,西单附近，品质铸信，可变四居毛坯，给予你自由装饰。,铸信境界??3室2厅??141平米??南,贝森二手房/高楼层(共29层)/2009年建板塔结合,泡小境界分校距离4号线清江西路站1094米随时看房,160万,11348 元/m2,172人看过此房
23,精装套二带阳台 环境又好学区房 低楼层适合老人,锦江印象??2室1厅??93.76平米??南,合江亭二手房/低楼层(共31层)/2008年建板塔结合,龙王庙小学距离2号线东门大桥站820米随时看房,102万,10879 元/m2,113人看过此房
24,桐梓林地铁口 家乐福 学区房 中庭位置 玉林生活广场,金地贝福里花园??3室2厅??146平米??南 北,桐梓林二手房/中楼层(共12层)/2007年建板楼,桐梓林小学距离1号线桐梓林站1092米随时看房,145万,9932 元/m2,195人看过此房
25,急售！！+中海套四 +精装修+ 拎包入住+ 可看河,中海格林威治城??4室2厅??161.5平米??东北,棕北二手房/中楼层(共32层)/2006年建板塔结合,川音附小距离2号线牛王庙站1068米房本满两年,238万,14737 元/m2,22人看过此房
26,世纪城地铁口 龙湖品质4房 正看锦江看公园 高楼层,天鹅湖花园??3室2厅??200平米??南,新会展二手房/低楼层(共32层)/2008年建塔楼,世纪城南路学校距离1号线世纪城站475米随时看房,180万,9000 元/m2,141人看过此房
27,急售！稀缺180°河景房，视野无敌 错过就没有了,泊景湾??3室2厅??117平米??北,龙湾二手房/高楼层(共18层)/2008年建板塔结合,川大附小清水河校区随时看房,180万,15385 元/m2,100人看过此房
28,精装三房 带家具家电 可拎包入住,富丽东方??3室2厅??114.23平米??东,成渝立交二手房/中楼层(共33层)/2008年建塔楼,树德小学距离2号线成渝立交站1088米随时看房,125万,10943 元/m2,22人看过此房
29,学区+电梯+地铁+套四+对西郊河+安静+采光好,聚星城??4室2厅??163平米??东 西,宽窄巷子二手房/低楼层(共12层)/2004年建板楼,距离4号线宽窄巷子站245米房本满两年,238万,14602 元/m2,19人看过此房
,title,where,other,chanquan,price,price-pre,square
0,坐等拆迁好房，一环边的老小区 黄金楼层,磨子村??2室1厅??60.86平米??西南,新华公园二手房/中楼层(共7层)/2000年建板楼,距离4号线玉双路站288米满五年唯一随时看房,54万,8873 元/m2,1人看过此房
1,黄金时代稀缺商铺.地铁商铺黄金地段.办公商业均绝佳,黄金时代??5室1厅??60平米??东,衣冠庙二手房/低楼层(共3层)/2004年建板楼,距离3号线衣冠庙站492米满五年唯一随时看房,770万,128334 元/m2,1人看过此房
2,黄华楼 标准套二 总价低,黄华楼??2室1厅??52平米??南,双楠二手房/高楼层(共7层)/1997年建塔楼,武侯实验小学距离3号线高升桥站1065米满五年唯一随时看房,41万,7885 元/m2,1人看过此房
3,精装大套二，自改套三，布局合理,新里柏仕公馆??3室1厅??89平米??南,东客站二手房/中楼层(共33层)/2011年建塔楼,距离2号线成渝立交站743米房本满两年随时看房,89万,10000 元/m2,33人看过此房
4,蜀郡三期叠拼别墅1跃2朝南 带车位前后花园100平,蜀郡??4室2厅??262平米??南,华阳二手房/低楼层(共3层)/2010年建塔楼,距离1号线华府大道站988米随时看房,335万,12787 元/m2,34人看过此房
5,华润大盘 稀缺1楼洋房 送2个花园 是的面积180O,华润橡树湾B区??3室2厅??144平米??东北,橡树湾二手房/低楼层(共6层)/2013年建板塔结合,思源小学房本满两年随时看房,110万,7639 元/m2,23人看过此房
6,急卖，急卖，30万买精装套一,新北社区??1室1厅??36平米??南,新北二手房/高楼层(共6层)/2000年建板楼,房本满两年独家随时看房,30万,8334 元/m2,17人看过此房
7,海科名城精致套二 房东诚心急卖,海科名城??2室2厅??85平米??南,温江大学城二手房/低楼层(共17层)/2011年建板楼,房本满两年独家随时看房,40万,4706 元/m2,11人看过此房
8,地铁优质套三 主卧带超大阳台 送装修 正对中庭   ,榕树岭??3室2厅??110平米??南,温江大学城二手房/高楼层(共26层)/2012年建塔楼,房本满两年随时看房,55万,5000 元/m2,36人看过此房
9,两室一厅 正朝南  采光好,城市物语??2室1厅??51.9平米??南,贝森二手房/低楼层(共10层)/2003年建板楼,距离4号线清江西路站782米房本满两年独家随时看房,45万,8671 元/m2,15人看过此房
10,3号线 高升桥 广福楼 可上户 小区环境单一,广福楼??2室1厅??94.35平米??西南,广福桥二手房/高楼层(共7层)/2000年建塔楼,距离3号线红牌楼站644米满五年唯一随时看房,70万,7420 元/m2,3人看过此房
11,房屋位于中庭位置 安静采光 居家套二 直接拎包入住,佰客郡??2室1厅??73.5平米??南,航空港二手房/低楼层(共16层)/2011年建板塔结合,川大西航港实小房本满两年独家随时看房,46万,6259 元/m2,20人看过此房
12,东麓驿境】【清水套二】【卧室带书房】【厅带阳台】,东麓驿境三期??2室2厅??89平米??南,龙泉驿城区二手房/中楼层(共18层)/2015年建板楼,龙泉实验小学房本满两年独家随时看房,54万,6068 元/m2,18人看过此房
13,私家花园50平，居家生活 养花种草 聚友喝茶的选择,翡翠城一期??3室2厅??113.05平米??东 南,东湖二手房/低楼层(共11层)/2005年建塔楼,成师附小华润分校随时看房,210万,18576 元/m2,35人看过此房
14,一楼带花园  正读锦西  明厨明卫  可落户,九里西苑A区??3室2厅??97.82平米??东南,九里堤二手房/低楼层(共7层)/2002年建板楼,锦西实小独家,94万,9610 元/m2,22人看过此房
15,稀缺套四，户型方正,华宇蓉国府??4室2厅??130平米??北,玉林二手房/高楼层(共28层)/2012年建板楼,玉林小学距离1号线倪家桥站325米房本满两年,270万,20770 元/m2,28人看过此房
16,菜市50米+欧尚100米+公园+送家具家电+棠湖学区,东立国际花城??3室2厅??122平米??南,蛟龙港二手房/中楼层(共14层)/2015年建塔楼,房本满两年,79万,6476 元/m2,4人看过此房
17,低总价高回报率，就读磨子桥小学分校，地铁距离800米,园中园东苑??4室2厅??168平米??东,五大花园二手房/高楼层(共7层)/2000年建板楼,磨小分校房本满两年随时看房,78万,4643 元/m2,9人看过此房
18,中等装修的标准的套二，家具家电全送，地铁口的学区房,中铁伊萨贝拉??2室2厅??79.61平米??西南,犀浦二手房/低楼层(共15层)/2010年建板楼,大田学校距离2号线犀浦站1047米房本满两年独家随时看房,50万,6281 元/m2,15人看过此房
19,农业厅稀缺套四 黄金二楼 一梯一户 可以拎包入住,武侯祠大街4号??4室2厅??147.8平米??东南,华西二手房/低楼层(共7层)/1995年建板塔结合,锦里小学距离1号线华西坝站988米房本满两年随时看房,165万,11164 元/m2,7人看过此房
20,1.3环 顺苑 精装套三 内跃带面积花园,顺苑??3室2厅??169.44平米??南,广福桥二手房/高楼层(共7层)/2000年建板楼,石室双楠实验学校距离3号线高升桥站773米房本满两年独家随时看房,145万,8558 元/m2,10人看过此房
21,地铁旁，石室中小学附近，绿色蔬菜，交通方便,水畔经典??2室1厅??83平米??南,李家沱二手房/中楼层(共21层)/2009年建塔楼,李家沱实验小学房本满两年独家随时看房,93万,11205 元/m2,13人看过此房
22,神仙树公园旁地铁口学区房 对中庭大套二 低价急售 ,金竹苑B区??2室1厅??88平米??南,神仙树二手房/高楼层(共7层)/1996年建板楼,高新实小旧校区房本满两年独家随时看房,68万,7728 元/m2,15人看过此房
23,金域香洲二楼带花园 中式复古装修,金域香洲??3室2厅??139平米??南,温江大学城二手房/低楼层(共6层)/2005年建板塔结合,房本满两年独家随时看房,78万,5612 元/m2,10人看过此房
24,中环附近 内跃花园房 稀缺带电梯 套四三卫 业主急售,协力苑??4室3厅??177平米??南,红牌楼二手房/高楼层(共11层)/2000年建板楼,距离3号线红牌楼站1020米房本满两年独家随时看房,137万,7741 元/m2,9人看过此房
25,中粮祥云，央企大盘，周边配套齐全，升值空间大,中粮祥云一期??4室2厅??161.12平米??西南,武侯立交二手房/中楼层(共17层)/2000年建板楼,龙江路小学祥云分校,215万,13345 元/m2,26人看过此房
26,独具特色 自然资源 宁静和谐 免个税哦 ！！！！,西华阳光??3室2厅??116平米??南,红光二手房/高楼层(共6层)/2002年建板楼,思源小学满五年唯一,54万,4656 元/m2,4人看过此房
27,简装小套三，明年就是真正的学区房了，不买别后悔啊！,沙河明珠??3室1厅??90.4平米??西,万象城二手房/中楼层(共18层)/2008年建塔楼,双庆小学满五年唯一,77万,8518 元/m2,4人看过此房
28,中铁品质两居，赠送入户花园，朝南视野开阔，赠送大阳台,中铁双龙湾??2室2厅??91平米??南,外金沙二手房/中楼层(共20层)/2008年建板塔结合,草堂小学西区距离4号线成都西站站1081米随时看房,94万,10330 元/m2,23人看过此房
29,武侯万达旁保利花园精装房 对中庭 视野好到爆,保利花园二期??2室2厅??76平米??东南,新双楠二手房/中楼层(共15层)/2012年建板楼,百草园小学随时看房,96万,12632 元/m2,31人看过此房
,title,where,other,chanquan,price,price-pre,square
0,中粮新上房源，中庭位置，清水大套三，朝东南,中粮祥云二期??3室2厅??129平米??东南,武侯立交二手房/低楼层(共17层)/2014年建板楼,龙江路小学祥云分校随时看房,180万,13954 元/m2,22人看过此房
1,幸福枫景89平米，精装套二，客厅带阳台，可正读茶小 ,幸福枫景??2室2厅??89.4平米??东南,茶店子二手房/高楼层(共11层)/2001年建塔楼,茶店子小学南区随时看房,93万,10403 元/m2,23人看过此房
2,英伦金沙 稀缺套三双卫 中装空房拎包住 正读草堂小学,英伦金沙??3室2厅??86.36平米??南,外金沙二手房/中楼层(共24层)/2011年建板塔结合,草堂小学西区距离4号线清江西路站854米随时看房,79万,9148 元/m2,29人看过此房
3,英郡稀缺二居室，投资居家均可，生活交通便利,英郡三期??2室2厅??81.25平米??西北,新会展二手房/中楼层(共33层)/2012年建板塔结合,世纪城南路学校距离1号线世纪城站607米随时看房,100万,12308 元/m2,28人看过此房
4,地铁旁精装套二 中间楼层采光好 前后中庭,西区花园花园洋房??2室2厅??82平米??东北,犀浦二手房/中楼层(共6层)/2004年建板楼,犀浦实验小学距离2号线天河路站170米满五年唯一,55万,6708 元/m2,3人看过此房
5,南一环 华西附近 小套二 双地铁物业 精装 学区房,米兰风度花园??2室1厅??69.9平米??北,华西二手房/中楼层(共8层)/2003年建板楼,距离3号线衣冠庙站535米满五年唯一,77万,11016 元/m2,9人看过此房
6,温中旁 优质自住精装套二 拎包入户 满两年,世纪光华??2室1厅??86平米??西南,花都大道二手房/低楼层(共18层)/2007年建板塔结合,温江光华实验小学满五年唯一,45万,5233 元/m2,2人看过此房
7,精装套三，居家物超所值,三和南锦??3室2厅??115平米??南,中和二手房/中楼层(共6层)/2008年建塔楼,满五年唯一,88万,7653 元/m2,5人看过此房
8,琉璃厂套三清水 想怎么装就怎么装 ,经天路8号??3室2厅??107.56平米??东 西,琉璃场二手房/中楼层(共7层)/2006年建板楼,盐道街小学得胜分校满五年唯一,70万,6508 元/m2,5人看过此房
9,新交大对面 投资居家过渡 精装套二 对中庭,交大卡布里城??2室2厅??80平米??西南,犀浦二手房/中楼层(共25层)/2009年建板楼,犀浦外国语学校满五年唯一,65万,8125 元/m2,2人看过此房
10,正对中庭   精装拎包入住  黄金楼层 正读美国学校,美洲花园一期??3室2厅??110平米??西南,新北二手房/高楼层(共6层)/2005年建板楼,房本满两年独家,88万,8000 元/m2,12人看过此房
11,南方福苑   精装套二  衣冠庙地铁口,洗面桥街21号??2室2厅??105.6平米??北,华西二手房/中楼层(共15层)/2002年建板楼,距离3号线衣冠庙站335米满五年唯一,98万,9281 元/m2,2人看过此房
12,启明柳岸馨苑 3室2厅 62万,启明柳岸馨苑??3室2厅??136平米??东南,温江大学城二手房/低楼层(共6层)/2006年建板塔结合,满五年唯一,62万,4559 元/m2,0人看过此房
13,邮局单位房公摊小 楼顶带花园精装修标准套二拎包入住,双林路332号??2室1厅??77.49平米??东,猛追湾二手房/高楼层(共7层)/1998年建板塔结合,双语实验距离4号线玉双路站594米满五年唯一,68万,8776 元/m2,3人看过此房
14,俯看浣花溪公园全景 电梯内跃带屋顶花园 草小房,龙景花园??6室2厅??223平米??东南,浣花溪二手房/高楼层(共5层)/2006年建板楼,草小本部房本满两年随时看房,750万,33633 元/m2,2人看过此房
15,此房稀缺户型，赠送30平大阳台标准大套三，房东诚心，,锦江城市花园一期??3室2厅??88.6平米??西南,三圣乡二手房/高楼层(共34层)/2009年建板楼,锦江外国语小学房本满两年独家随时看房,75万,8466 元/m2,3人看过此房
16,建设路，品质龙湖，完美套二，居家，投资。首选之地。,龙湖三千里A区一期??2室2厅??70平米??西,SM广场二手房/中楼层(共34层)/2008年建塔楼,建设路小学本部随时看房,84万,12000 元/m2,39人看过此房
17,城西双地铁口，西单商场多门  黄金地段，新上大套三,新阳光健康家园??3室2厅??124平米??南,贝森二手房/高楼层(共10层)/2001年建板楼,青羊实验附小距离4号线清江西路站584米随时看房,105万,8468 元/m2,67人看过此房
18,新上东方新城地铁套二 业主急售 无税 楼下就是公交,东方新城一期??2室1厅??67.77平米??南,九眼桥二手房/高楼层(共12层)/2007年建板塔结合,教师进修校附小距离2号线牛市口站524米随时看房,65万,9592 元/m2,42人看过此房
19,梧桐世家精装小套二 户型方正 临近地铁,梧桐世家一期??2室2厅??65.87平米??南,芳草二手房/低楼层(共12层)/2004年建板楼,芳草小学距离3号线衣冠庙站484米随时看房,70万,10627 元/m2,62人看过此房
20,外双楠 清水河畔 06年电梯地铁学区集一身的小区,丽景华庭一期??2室2厅??80平米??东,外双楠二手房/高楼层(共12层)/2003年建板楼,川大附小清水河校区随时看房,75万,9375 元/m2,33人看过此房
21,配套成熟 地铁500米 楼下就是金沙车站 战旗小学,金沙岁月??2室1厅??51.3平米??南,府南新区二手房/高楼层(共12层)/2005年建板楼,实小战旗分校距离4号线文化宫站359米随时看房,46万,8967 元/m2,54人看过此房
22,汇尚园稀缺套二户型，带入户花园，视野超好，安静,南城都汇汇尚园??2室2厅??89平米??西南,市一医院二手房/高楼层(共22层)/2014年建塔楼,锦城小学距离1号线高新站1091米随时看房,118万,13259 元/m2,84人看过此房
23,东西通透，套三对中庭。,佳兆业君汇上品??3室2厅??115.61平米??西南,南湖二手房/中楼层(共33层)/2013年建板塔结合,随时看房,98万,8477 元/m2,57人看过此房
24,红牌楼新希望开发酒店式装修标准套一,红楠港??1室1厅??53.75平米??西南,红牌楼二手房/中楼层(共15层)/2000年建板楼,距离3号线红牌楼站194米随时看房,62万,11535 元/m2,32人看过此房
25,远离三环安静 直接上户 带入户花园 大套二,保利金香槟??2室2厅??92.37平米??东北,外金沙二手房/高楼层(共18层)/2012年建板塔结合,金沙小学清波校区随时看房,96万,10393 元/m2,36人看过此房
26,"正读东小,楼层好,户型正,采光靓,视野棒,不临街套一",西岸蒂景??2室1厅??58平米??南,八宝街二手房/高楼层(共12层)/2004年建塔楼,东城根小学距离4号线宽窄巷子站993米随时看房,69万,11897 元/m2,73人看过此房
27,《一梯三户.省工商银行宿舍》电梯小高层.楼顶带花园.,大墙东街小区??3室2厅??126.7平米??东,太升路二手房/高楼层(共8层)/1999年建板楼,距离4号线太升南路站260米房本满两年独家随时看房,149万,11761 元/m2,2人看过此房
28,地铁3号线 标准套二 王府花园,王府花园??2室2厅??107平米??南,芳草二手房/低楼层(共18层)/2002年建塔楼,芳草小学距离3号线衣冠庙站139米随时看房,116万,10842 元/m2,37人看过此房
29,地铁3号线1.5环左邻右舍 54万套一可改套二 ,左邻右舍??1室1厅??51.16平米??南,高升桥二手房/高楼层(共18层)/2010年建板楼,红牌楼小学距离3号线红牌楼站546米房本满两年随时看房,54万,10556 元/m2,26人看过此房
,title,where,other,chanquan,price,price-pre,square
0,04年 纯框架 交大园林小区 送大气阳台主卧5面采光,交大智能九期??3室2厅??122.22平米??南,花照壁二手房/中楼层(共6层)/2004年建塔楼,行知小学随时看房,110万,9001 元/m2,36人看过此房
1,套二双卫  看河  带学区    低首付,翡翠城四期??2室2厅??85.21平米??东南,东湖二手房/高楼层(共29层)/2007年建板楼,成师附小华润分校随时看房,86万,10093 元/m2,34人看过此房
2,正基城市主场 精装小套二 距地铁口10米 ,正基城市主场??2室1厅??61.24平米??南,五大花园二手房/高楼层(共20层)/2012年建板楼,龙祥路小学房本满两年随时看房,60万,9798 元/m2,29人看过此房
3,中环配套 多层一楼小套二 居家保养 前后中庭 诚售,园中园南苑??2室1厅??67平米??西南,五大花园二手房/低楼层(共7层)/2000年建板楼,磨小分校房本满两年随时看房,52万,7762 元/m2,31人看过此房
4,黄金三楼 不临街 居家套二 急售,菊乐路180号??2室1厅??70.23平米??北,双楠二手房/中楼层(共7层)/1999年建板塔结合,武侯实验小学距离3号线高升桥站902米房本满两年随时看房,60万,8544 元/m2,23人看过此房
5,保利玫瑰大套三，南北通透户型,保利公园198玫瑰郡??3室2厅??137平米??南,保利公园二手房/低楼层(共11层)/2010年建板楼,新都蜀龙学校房本满两年随时看房,72万,5256 元/m2,25人看过此房
6,圣菲经典户型  套二入户带双阳 朝南采光好  ,蓝光圣菲town城??2室2厅??77.75平米??东南,航空港二手房/低楼层(共22层)/2009年建塔楼,川大西航港实小房本满两年随时看房,53万,6817 元/m2,24人看过此房
7,百花庭院 中庭4楼完全不临街 双证齐全 满五年 急售,百花庭园??3室2厅??123.51平米??南,双楠二手房/中楼层(共6层)/2000年建板塔结合,武侯实验小学距离3号线高升桥站1017米房本满两年随时看房,120万,9716 元/m2,7人看过此房
8,一环路 九眼桥 牛王庙 天紫界 投资自住好房!,天紫界??2室1厅??91平米??东 南,九眼桥二手房/高楼层(共55层)/2011年建板楼,距离2号线牛王庙站231米房本满两年随时看房,125万,13737 元/m2,29人看过此房
9,地铁旁 钢管厂五区居中楼层套二 目前单价低一套诚售,钢管厂五区??2室1厅??70.43平米??南,莲花二手房/中楼层(共7层)/2001年建板楼,教师进修校附小距离2号线牛市口站564米房本满两年随时看房,56万,7952 元/m2,57人看过此房
10,观锦江位置 带车位 安静 清水房,东苑D区??3室2厅??135平米??南,东苑二手房/高楼层(共26层)/2009年建板楼,七中附小房本满两年随时看房,215万,15926 元/m2,62人看过此房
11,翰林上岛精装套二满两年独家房源,翰林上岛??2室1厅??65平米??东,航空港二手房/低楼层(共16层)/2008年建塔楼,西航港小学房本满两年随时看房,55万,8462 元/m2,25人看过此房
12,左右小区，精装套二，投资过度首选！,左右??2室1厅??61平米??南,光华泡小二手房/高楼层(共25层)/2010年建塔楼,房本满两年随时看房,48万,7869 元/m2,81人看过此房
13,恒大绿洲精装小高层，大套三,恒大绿洲??3室2厅??123平米??北,大面二手房/中楼层(共11层)/2011年建板塔结合,房本满两年随时看房,92万,7480 元/m2,5人看过此房
14,春熙路王府井背后+清水房+标准套二 投资过渡首选,萧邦??2室1厅??73.6平米??南,盐市口二手房/中楼层(共28层)/2000年建板楼,距离4号线市二医院站363米房本满两年随时看房,83万,11278 元/m2,29人看过此房
15,标准套三+客厅正带阳台+功能间齐全+正朝南+视野开阔,四季映像??3室2厅??74.83平米??南,大面二手房/高楼层(共33层)/2012年建塔楼,房本满两年随时看房,45万,6014 元/m2,23人看过此房
16,高升桥电梯公寓 标准套一 稀缺清水,左邻右舍??1室1厅??51.84平米??南,高升桥二手房/低楼层(共18层)/2010年建板楼,红牌楼小学距离3号线红牌楼站546米房本满两年随时看房,50万,9646 元/m2,25人看过此房
17,地铁房100距离给孩子一个学习家园,书香府邸??2室1厅??91平米??东南,成外二手房/低楼层(共16层)/2009年建板楼,犀浦实验小学距离2号线百草路站93米房本满两年随时看房,58万,6374 元/m2,23人看过此房
18,毫无浪费的套二，洪河口不远处的10楼,锦江城市花园三期??2室1厅??55.77平米??西南,三圣乡二手房/低楼层(共34层)/2011年建板塔结合,锦江外国语小学房本满两年随时看房,46万,8249 元/m2,36人看过此房
19,买华润，住央企（黄金19楼，满2年，对中庭）可谈,华润橡树湾A区??3室2厅??79平米??西南,橡树湾二手房/中楼层(共34层)/2013年建板塔结合,思源小学房本满两年随时看房,58万,7342 元/m2,21人看过此房
20,婚房首选.送15平大阳台,华润橡树湾A区??3室2厅??54平米??西南,橡树湾二手房/中楼层(共34层)/2013年建板塔结合,思源小学房本满两年随时看房,59万,10926 元/m2,36人看过此房
21,万科三期，户型方正，采光足。朝向好,万科魅力之城三期??3室2厅??133.75平米??东南,成渝立交二手房/低楼层(共15层)/2008年建板塔结合,树德小学距离2号线成渝立交站479米房本满两年随时看房,158万,11814 元/m2,53人看过此房
22,观城洋房、套四大平层,观城??4室2厅??135.6平米??南 北,万象城二手房/中楼层(共8层)/2013年建板塔结合,双庆小学距离4号线万年场站站238米随时看房,235万,17331 元/m2,54人看过此房
23,时代豪庭 套三双卫 送大阳台 可读七中 地铁2号线口,时代豪庭一期??3室2厅??155平米??南,合江亭二手房/低楼层(共35层)/2009年建板塔结合,距离2号线东门大桥站18米随时看房,225万,14517 元/m2,45人看过此房
24,天府新区 豪华大平层 5室2厅1厨3卫,三利云锦??5室2厅??224平米??南,华阳二手房/低楼层(共39层)/2013年建塔楼,距离1号线华府大道站17米随时看房,265万,11831 元/m2,32人看过此房
